,Patent's id,WWW_link,Title,Abstract,Publication_date,Owner,Inventors,Image_link,Similarity,patentBERT,BERT,Roberta
44,US20020029190A1,https://patents.google.com/patent/US20020029190A1/en,Money-transfer techniques,"A financial institution has a web-based server for use in transferring money between a customer and a beneficiary. The server provides an online money-transfer service via the Internet and the PSTN (Public Switched Telephone Network). A customer, having a client computer, a telephone having DTMF (Dual-Tone, Multiple Frequency) access and a credit card, opens a transaction web page provided by the server. The customer inputs transaction data into the web page, including the sum of money, customer and beneficiary data, and basic payment data, such as credit-card information except, perhaps, the credit card number. The customer sends the transaction data to the server via the Internet. After the customer confirms the transaction data in a second web page, the server instructs the customer to contact the financial institution via the customer's telephone. Upon receiving the customer's telephone call, the server looks for a match between a received ANI (automatic number identification) signal and the telephone number provided by the customer. The customer then punches in the credit card number, and, in return, receives a fund-pick-up (“folio”) number in an audio message. The customer provides the beneficiary with the fund-pick-up number to use in collecting the funds.",2002-03-07,"UniTeller Financial Services, Inc.",Luis Eduardo Gutierrez-Sheris,https://api.projectpq.ai/patents/US20020029190A1/thumbnails/1,51.14,39.51,85.05,47.34
45,US6339638B1,https://patents.google.com/patent/US6339638B1/en,Telephone used for electronic money card transaction and method of operation of the same,"A telephone for transferring electronic money between money cards has on the top thereof two card inlets of two internal card reader/writers, a display window, a ten-key set used to dial a telephone number or enter an amount of electronic money transaction, telephone function keys, and mode selection keys. It can be operated to transfer electronic money between two money cards inserted in the card inlets, or between a money card inserted in one of the card inlets and another money card linked through the telephone line, thereby enabling person-to-person, person-to-bank, and person-to-retailer transactions based on electronic money.",2002-01-15,"Hitachi, Ltd.","Masayuki Ohki, Atsuhiko Urushibara, Jun Furuya, Shigeyuki Ito, Hiroki Kitagawa, Takao Oosawa",https://api.projectpq.ai/patents/US6339638B1/thumbnails/1,51.05,33.95,86.45,48.71
46,US20060258337A1,https://patents.google.com/patent/US20060258337A1/en,"Portable terminal device, portable terminal oriented method, portable terminal oriented program, currency information issuance server apparatus, currency information issuance method, and currency information issuance program","A portable telephone (7) comprises a telephone function part (10) having a voice communications function and an Internet connecting function, and an electronic money function part (12) configured to conduct VALUE storage and VALUE handling. The telephone function part (10) is capable of accessing to a service site of an electronic money server (2) via Internet (4). Request by a user from the telephone function part (10) to the service site of the electronic money server (2) for VALUE entering, causes the electronic money server (2) to transmit an entering command to the portable telephone (7) for causing the electronic money function part (12) to execute VALUE entering. The electronic money function part (12) inputs the entering command in the electronic money function part (12) thereby causing the electronic money function part (12) to conduct an entering procedure.",2006-11-16,Assignee N/A,"Norihiko Fujita, Koji Ito, Hisanori Arai, Masaii Nagai",https://api.projectpq.ai/patents/US20060258337A1/thumbnails/1,50.89,81.86,81.58,48.52
47,US20220405757A1,https://patents.google.com/patent/US20220405757A1/en,Mobile Money Management System,"A mobile money management system, apparatus and method for conducting financial transactions using mobile devices, and more particularly to the use of cellular telephones or other handheld or wearable personal computing devices, for organizing and presenting information related to financial transactions, including sales transactions via a wireless communication link.",2022-12-22,Christian Hansen,Christian Hansen,https://api.projectpq.ai/patents/US20220405757A1/thumbnails/1,50.78,41.24,77.83,59.3
48,US20090187508A1,https://patents.google.com/patent/US20090187508A1/en,Business method for using a phone to transact financial transactions,"A business method for using phones to transact financial transactions in a secured and verified manner. The business method for using phones to transact financial transactions comprises registering the user with a registration system. Having the user initiate a financial transaction over a specific telephone. Verifying if the initiated user financial transaction is legitimate. Lastly, transferring funds in accordance with user instructions previously provided.",2009-07-23,Assignee N/A,Nicolas Placide,https://api.projectpq.ai/patents/US20090187508A1/thumbnails/1,50.76,38.91,81.31,41.9
49,US20180247296A1,https://patents.google.com/patent/US20180247296A1/en,MOBILE PAYMENT SYSTEM,"The present document describes a payment system that processes transactions originating from mobile phones, cellular devices, Web browsers, or other mobile devices. A customer initiates a transaction by sending a payment request via SMS, HTTPS, or other network protocol. The payment request includes an amount to be paid and a phone number associated with a recipient. The payment system confirms the identity of the customer, and identifies the recipient based at least in part on the phone number. The payment system supports the fulfillment of payment requests with various combinations of account balances, credit accounts, discounts, and loyalty points. The payment system also provides various merchant features such as ticket vending, automatic discovery of payees and payers, management of merchant terminals, and payroll processing.",2018-08-30,Assignee N/A,"Tun Tun Win, Manickam Subramanian, Abhishek Modi, Shivam Srivastava",https://api.projectpq.ai/patents/US20180247296A1/thumbnails/1,50.61,38.66,86.6,51.47
